{
  "$schema": "../schemas/bed.schema.json",
  "id": "bed-e",
  "name": "Terrace Flower Bed",
  "physical": {
    "position": "Bed 5, terrace north end",
    "dimensions": { "length_cm": 80, "width_cm": 40, "height_cm": 30 },
    "material": "galvanized_steel",
    "features": ["lightweight-soil-mix"],
    "orientation": "N-S"
  },
  "crops": [
    {
      "crop_id": "borage",
      "shortcode": "BOR",
      "positions": [
        { "center_w": 15, "center_l": 30, "spread_cm": 35 }
      ],
      "planted_week": 17
    },
    {
      "crop_id": "calendula",
      "shortcode": "CAL",
      "positions": [
        { "center_w": 5, "center_l": 10, "spread_cm": 22 },
        { "center_w": 35, "center_l": 75, "spread_cm": 22 }
      ],
      "planted_week": 17
    },
    {
      "crop_id": "broccoli-calabrese",
      "shortcode": "BRC",
      "positions": [
        { "center_w": 20, "center_l": 55, "spread_cm": 35 }
      ],
      "planted_week": 21
    },
    {
      "crop_id": "bush-bean-provider",
      "shortcode": "BN",
      "positions": [
        { "center_w": 35, "center_l": 10, "spread_cm": 12 },
        { "center_w": 35, "center_l": 22, "spread_cm": 12 },
        { "center_w": 35, "center_l": 34, "spread_cm": 12 },
        { "center_w": 35, "center_l": 46, "spread_cm": 12 },
        { "center_w": 35, "center_l": 58, "spread_cm": 12 },
        { "center_w": 35, "center_l": 70, "spread_cm": 12 }
      ],
      "planted_week": 20
    },
    {
      "crop_id": "dill",
      "shortcode": "DIL",
      "positions": [
        { "center_w": 10, "center_l": 70, "spread_cm": 25 }
      ],
      "planted_week": 18
    }
  ],
  "succession_slots": [],
  "ha_sensors": {
    "moisture": "sensor.havn_bed_e_moisture",
    "temperature": "sensor.havn_bed_e_temperature"
  }
}
